16:12:55.015982 ARP, Request who-has vaishnavi-Vostro-15-3568 tell 192.168.43.1, length 28
16:12:55.015998 ARP, Reply vaishnavi-Vostro-15-3568 is-at ac:ed:5c:ac:54:b3 (oui Unknown), length 28
16:13:32.304137 ARP, Request who-has vaishnavi-Vostro-15-3568 tell 192.168.43.1, length 28
16:13:32.304158 ARP, Reply vaishnavi-Vostro-15-3568 is-at ac:ed:5c:ac:54:b3 (oui Unknown), length 28
16:13:49.646140 ARP, Request who-has 192.168.43.1 tell vaishnavi-Vostro-15-3568, length 28
16:13:49.651327 ARP, Reply 192.168.43.1 is-at d6:14:75:0d:92:70 (oui Unknown), length 28
16:13:54.590877 ARP, Request who-has vaishnavi-Vostro-15-3568 tell 192.168.43.1, length 28
16:13:54.590890 ARP, Reply vaishnavi-Vostro-15-3568 is-at ac:ed:5c:ac:54:b3 (oui Unknown), length 28
16:14:24.909107 ARP, Request who-has vaishnavi-Vostro-15-3568 tell 192.168.43.1, length 28
16:14:24.909132 ARP, Reply vaishnavi-Vostro-15-3568 is-at ac:ed:5c:ac:54:b3 (oui Unknown), length 28
16:15:03.077265 ARP, Request who-has vaishnavi-Vostro-15-3568 tell 192.168.43.1, length 28
16:15:03.077282 ARP, Reply vaishnavi-Vostro-15-3568 is-at ac:ed:5c:ac:54:b3 (oui Unknown), length 28
16:15:35.051185 ARP, Request who-has vaishnavi-Vostro-15-3568 tell 192.168.43.1, length 28
16:15:35.051203 ARP, Reply vaishnavi-Vostro-15-3568 is-at ac:ed:5c:ac:54:b3 (oui Unknown), length 28
16:15:55.019565 ARP, Request who-has 192.168.43.10 tell vaishnavi-Vostro-15-3568, length 28
16:15:56.018166 ARP, Request who-has 192.168.43.10 tell vaishnavi-Vostro-15-3568, length 28
16:15:57.018178 ARP, Request who-has 192.168.43.10 tell vaishnavi-Vostro-15-3568, length 28
16:15:58.035524 ARP, Request who-has 192.168.43.10 tell vaishnavi-Vostro-15-3568, length 28
16:15:59.034194 ARP, Request who-has 192.168.43.10 tell vaishnavi-Vostro-15-3568, length 28
16:16:00.034184 ARP, Request who-has 192.168.43.10 tell vaishnavi-Vostro-15-3568, length 28
16:16:01.051555 ARP, Request who-has 192.168.43.10 tell vaishnavi-Vostro-15-3568, length 28
16:16:02.050195 ARP, Request who-has 192.168.43.10 tell vaishnavi-Vostro-15-3568, length 28
16:16:03.050186 ARP, Request who-has 192.168.43.10 tell vaishnavi-Vostro-15-3568, length 28
16:16:04.067533 ARP, Request who-has 192.168.43.10 tell vaishnavi-Vostro-15-3568, length 28
16:16:05.066142 ARP, Request who-has 192.168.43.10 tell vaishnavi-Vostro-15-3568, length 28
16:16:06.066182 ARP, Request who-has 192.168.43.10 tell vaishnavi-Vostro-15-3568, length 28
16:16:07.083526 ARP, Request who-has 192.168.43.10 tell vaishnavi-Vostro-15-3568, length 28
16:16:08.082180 ARP, Request who-has 192.168.43.10 tell vaishnavi-Vostro-15-3568, length 28
16:16:09.082178 ARP, Request who-has 192.168.43.10 tell vaishnavi-Vostro-15-3568, length 28
16:16:10.099521 ARP, Request who-has 192.168.43.10 tell vaishnavi-Vostro-15-3568, length 28
16:16:11.098188 ARP, Request who-has 192.168.43.10 tell vaishnavi-Vostro-15-3568, length 28
16:16:12.098179 ARP, Request who-has 192.168.43.10 tell vaishnavi-Vostro-15-3568, length 28
16:16:13.115494 ARP, Request who-has 192.168.43.10 tell vaishnavi-Vostro-15-3568, length 28
16:16:14.114186 ARP, Request who-has 192.168.43.10 tell vaishnavi-Vostro-15-3568, length 28
16:16:15.114182 ARP, Request who-has 192.168.43.10 tell vaishnavi-Vostro-15-3568, length 28
16:16:18.075104 ARP, Request who-has vaishnavi-Vostro-15-3568 tell 192.168.43.1, length 28
16:16:18.075120 ARP, Reply vaishnavi-Vostro-15-3568 is-at ac:ed:5c:ac:54:b3 (oui Unknown), length 28
